{
  "conformance_version": 2,
  "contract_schema_version": 16,
  "cases": [
    {
      "id": "terraform-destroy-is-cloud-delete",
      "description": "Legacy golden vector: terraform-destroy-is-cloud-delete",
      "category": "execution_boundary",
      "kind": "execution_boundary",
      "input": {
        "planned_operations": [
          "cloud.resource_delete"
        ],
        "actual_operations": [
          "cloud.resource_delete"
        ],
        "actual_action": "terraform destroy -auto-approve",
        "affected_resources": [
          "infra/main.tf"
        ],
        "targets": [
          "cloud/project-demo"
        ],
        "environment": "test",
        "exposure_facts": {
          "data_classification": "public",
          "credential_class": "none",
          "tenant_scope": "single_user",
          "public_visibility": "none",
          "estimated_blast_radius": "single_resource",
          "estimated_financial_impact": "none"
        }
      },
      "expected": {
        "status": "PASS",
        "effective_effect": "L4",
        "effective_exposure": "X0",
        "action_gate": "REQUIRE_EXPLICIT_APPROVAL"
      },
      "normative_fields": [
        "status",
        "effective_effect",
        "effective_exposure",
        "action_gate"
      ]
    },
    {
      "id": "git-reset-hard-is-destructive",
      "description": "Legacy golden vector: git-reset-hard-is-destructive",
      "category": "execution_boundary",
      "kind": "execution_boundary",
      "input": {
        "planned_operations": [
          "git.destructive_change"
        ],
        "actual_operations": [
          "git.destructive_change"
        ],
        "actual_action": "git reset --hard HEAD~1",
        "affected_resources": [
          ".git/refs/heads/main"
        ],
        "targets": [
          "repository/main"
        ],
        "environment": "local",
        "exposure_facts": {
          "data_classification": "public",
          "credential_class": "none",
          "tenant_scope": "single_user",
          "public_visibility": "none",
          "estimated_blast_radius": "single_resource",
          "estimated_financial_impact": "none"
        }
      },
      "expected": {
        "status": "PASS",
        "effective_effect": "L4",
        "effective_exposure": "X0",
        "action_gate": "REQUIRE_EXPLICIT_APPROVAL"
      },
      "normative_fields": [
        "status",
        "effective_effect",
        "effective_exposure",
        "action_gate"
      ]
    },
    {
      "id": "public-package-publish-escalates-l4",
      "description": "Legacy golden vector: public-package-publish-escalates-l4",
      "category": "execution_boundary",
      "kind": "execution_boundary",
      "input": {
        "planned_operations": [
          "package.publish"
        ],
        "actual_operations": [
          "package.publish"
        ],
        "actual_action": "npm publish --access public",
        "affected_resources": [
          "package.json"
        ],
        "targets": [
          "registry.npmjs.org/example-package"
        ],
        "environment": "external",
        "exposure_facts": {
          "data_classification": "public",
          "credential_class": "none",
          "tenant_scope": "single_user",
          "public_visibility": "public_destination",
          "estimated_blast_radius": "bounded_set",
          "estimated_financial_impact": "none"
        }
      },
      "expected": {
        "status": "PASS",
        "effective_effect": "L4",
        "effective_exposure": "X2",
        "action_gate": "REQUIRE_EXPLICIT_APPROVAL"
      },
      "normative_fields": [
        "status",
        "effective_effect",
        "effective_exposure",
        "action_gate"
      ]
    },
    {
      "id": "isolated-staging-package-publish-remains-l3",
      "description": "Legacy golden vector: isolated-staging-package-publish-remains-l3",
      "category": "execution_boundary",
      "kind": "execution_boundary",
      "input": {
        "planned_operations": [
          "package.publish"
        ],
        "actual_operations": [
          "package.publish"
        ],
        "actual_action": "publish package to isolated staging registry",
        "affected_resources": [
          "package.json"
        ],
        "targets": [
          "registry.staging.internal/example-package"
        ],
        "environment": "staging",
        "exposure_facts": {
          "data_classification": "internal",
          "credential_class": "none",
          "tenant_scope": "single_tenant",
          "public_visibility": "none",
          "estimated_blast_radius": "bounded_set",
          "estimated_financial_impact": "negligible"
        }
      },
      "expected": {
        "status": "PASS",
        "effective_effect": "L3",
        "effective_exposure": "X1",
        "action_gate": "REQUIRE_EXPLICIT_APPROVAL"
      },
      "normative_fields": [
        "status",
        "effective_effect",
        "effective_exposure",
        "action_gate"
      ]
    },
    {
      "id": "production-deploy-escalates-l4-x2",
      "description": "Legacy golden vector: production-deploy-escalates-l4-x2",
      "category": "execution_boundary",
      "kind": "execution_boundary",
      "input": {
        "planned_operations": [
          "deploy.execute"
        ],
        "actual_operations": [
          "deploy.execute"
        ],
        "actual_action": "deploy service api",
        "affected_resources": [
          "deploy/service.yaml"
        ],
        "targets": [
          "cluster/prod/api"
        ],
        "environment": "production",
        "exposure_facts": {
          "data_classification": "internal",
          "credential_class": "service_credential",
          "tenant_scope": "single_tenant",
          "public_visibility": "none",
          "estimated_blast_radius": "service",
          "estimated_financial_impact": "bounded"
        }
      },
      "expected": {
        "status": "PASS",
        "effective_effect": "L4",
        "effective_exposure": "X2",
        "action_gate": "REQUIRE_EXPLICIT_APPROVAL"
      },
      "normative_fields": [
        "status",
        "effective_effect",
        "effective_exposure",
        "action_gate"
      ]
    },
    {
      "id": "privileged-secret-read-is-x3",
      "description": "Legacy golden vector: privileged-secret-read-is-x3",
      "category": "execution_boundary",
      "kind": "execution_boundary",
      "input": {
        "planned_operations": [
          "secret.read"
        ],
        "actual_operations": [
          "secret.read"
        ],
        "actual_action": "read production deployment secret",
        "affected_resources": [
          "secret://prod/deploy"
        ],
        "targets": [
          "secret/prod/deploy"
        ],
        "environment": "production",
        "exposure_facts": {
          "data_classification": "restricted",
          "credential_class": "privileged_credential",
          "tenant_scope": "organization_wide",
          "public_visibility": "none",
          "estimated_blast_radius": "service",
          "estimated_financial_impact": "bounded"
        }
      },
      "expected": {
        "status": "PASS",
        "effective_effect": "L1",
        "effective_exposure": "X3",
        "action_gate": "REQUIRE_EXPLICIT_APPROVAL"
      },
      "normative_fields": [
        "status",
        "effective_effect",
        "effective_exposure",
        "action_gate"
      ]
    },
    {
      "id": "generated-build-delete-is-reversible",
      "description": "Legacy golden vector: generated-build-delete-is-reversible",
      "category": "execution_boundary",
      "kind": "execution_boundary",
      "input": {
        "planned_operations": [
          "filesystem.generated_delete"
        ],
        "actual_operations": [
          "filesystem.generated_delete"
        ],
        "actual_action": "rm -rf ./build",
        "affected_resources": [
          "build/"
        ],
        "targets": [
          "workspace/build"
        ],
        "environment": "local",
        "exposure_facts": {
          "data_classification": "public",
          "credential_class": "none",
          "tenant_scope": "single_user",
          "public_visibility": "none",
          "estimated_blast_radius": "single_resource",
          "estimated_financial_impact": "none"
        }
      },
      "expected": {
        "status": "PASS",
        "effective_effect": "L2",
        "effective_exposure": "X0",
        "action_gate": "AUTO"
      },
      "normative_fields": [
        "status",
        "effective_effect",
        "effective_exposure",
        "action_gate"
      ]
    },
    {
      "id": "general-local-delete-is-l4",
      "description": "Legacy golden vector: general-local-delete-is-l4",
      "category": "execution_boundary",
      "kind": "execution_boundary",
      "input": {
        "planned_operations": [
          "filesystem.delete"
        ],
        "actual_operations": [
          "filesystem.delete"
        ],
        "actual_action": "rm -rf ./user-work",
        "affected_resources": [
          "user-work/"
        ],
        "targets": [
          "workspace/user-work"
        ],
        "environment": "local",
        "exposure_facts": {
          "data_classification": "public",
          "credential_class": "none",
          "tenant_scope": "single_user",
          "public_visibility": "none",
          "estimated_blast_radius": "single_resource",
          "estimated_financial_impact": "none"
        }
      },
      "expected": {
        "status": "PASS",
        "effective_effect": "L4",
        "effective_exposure": "X0",
        "action_gate": "REQUIRE_EXPLICIT_APPROVAL"
      },
      "normative_fields": [
        "status",
        "effective_effect",
        "effective_exposure",
        "action_gate"
      ]
    },
    {
      "id": "kubectl-delete-pod-is-bounded-change",